{
  "episode_index": 0,
  "dataset_id": "TEAM/water-kitchen-policy1-smoke-v1",
  "run_id": "example-teleop-run-0001",
  "recorded_at": "2026-09-07T14:32:10+09:00",
  "operator": "op_a",
  "task": {
    "name": "water_kitchen_policy1",
    "instruction": "왼팔로 컵을 들고 오른팔로 물통을 기울인 뒤 물통을 원위치하고 컵을 선반에 놓으세요",
    "mission_stage": "KITCHEN_POLICY_1",
    "difficulty_stage": 1
  },
  "policy": {
    "id": "policy_1",
    "version": "contract-v1",
    "execution_mode": "teleop_demo",
    "action_representation": "absolute_joint_position",
    "config_id": "example-only"
  },
  "arms": {
    "mode": "simultaneous",
    "used": ["left", "right"],
    "teleop_device": "bi_so_leader",
    "calibration_files": {
      "left": "calib/left_example.json#sha256:example",
      "right": "calib/right_example.json#sha256:example"
    }
  },
  "objects": [
    {
      "role": "cup",
      "id": "cup_example_v1",
      "size_mm": [70, 70, 100],
      "mass_g": 20,
      "surface": "transparent",
      "start_zone": "kitchen_cup_slot",
      "goal_zone": "robot_shelf_cup_slot"
    },
    {
      "role": "jug",
      "id": "jug_example_v1",
      "surface": "mixed",
      "start_zone": "kitchen_jug_slot",
      "goal_zone": "kitchen_jug_slot"
    },
    {
      "role": "shelf",
      "id": "robot_shelf_example_v1",
      "surface": "mixed",
      "start_zone": "robot_shelf",
      "goal_zone": "robot_shelf"
    }
  ],
  "scene": {
    "lighting": "indoor_fluorescent",
    "background": "kitchen_bench_example",
    "distractors": 0,
    "location": "lab_bench_1",
    "station_id": "kitchen"
  },
  "robot": {
    "type": "hold_flow_bimanual_so101",
    "fps": 30,
    "cameras": [
      {
        "key": "observation.images.mast",
        "kind": "rgbd",
        "resolution": "640x480",
        "fps": 30,
        "usb_bus": "example-bus"
      }
    ],
    "firmware_or_commit": "example-only",
    "description_commit": "example-only"
  },
  "water_measurement": {
    "cup_id": "cup_example_v1",
    "target_ml": 0,
    "fill_class": "DRY_RUN",
    "calibration_id": "not-applicable-dry-run",
    "spill_detected": false
  },
  "outcome": {
    "success": true,
    "verified_by": "human_observation",
    "stage_results": {
      "cup_grasp": true,
      "jug_grasp": true,
      "pour_motion": true,
      "jug_return": true,
      "shelf_place": true
    },
    "duration_s": 18.4,
    "anomalies": [],
    "human_intervention_count": 0,
    "notes": "스키마 검증용 건식 예시이며 실제 수집 데이터가 아니다"
  },
  "split": "train",
  "include": true
}
